{
  "schemaVersion": "gymbro-program-catalog/1",
  "familyCode": "P01",
  "versionCode": "P01-M-v1",
  "status": "DRAFT",
  "durationWeeks": 12,
  "goalCoverage": [
    "PRISE_MUSCLE",
    "FORME_GENERALE",
    "FORCE"
  ],
  "prescriptionPolicy": "foundation-12w-v1",
  "progressionPolicy": "double-progression-v1",
  "maxSessionMinutes": 50,
  "weeks": [
    {
      "weekNumber": 1,
      "phaseNumber": 1,
      "sessions": [
        {
          "occurrenceCode": "P01-M-v1-W1-S1",
          "blueprintCode": "D-A",
          "sessionNumber": 1,
          "format": "STANDARD",
          "slots": [
            {
              "slotCode": "SQ",
              "variant": "M",
              "exerciseCode": "SQ-M-PRIMARY",
              "sessionPosition": 1,
              "defaultPrescription": {
                "sets": 3,
                "repsMin": 8,
                "repsMax": 12,
                "restSec": 120,
                "loadConvention": "MACHINE_DISPLAY"
              },
              "prescription": {
                "metric": "REPS",
                "workingSets": 3,
                "repsMin": 8,
                "repsMax": 12,
                "durationMinSeconds": null,
                "durationMaxSeconds": null,
                "targetRirMin": 2,
                "targetRirMax": 3,
                "restTargetSeconds": 120,
                "restAllowedMaxSeconds": 180,
                "loadConvention": "MACHINE_DISPLAY",
                "initialLoadKg": null
              }
            },
            {
              "slotCode": "HP",
              "variant": "M",
              "exerciseCode": "HP-M-PRIMARY",
              "sessionPosition": 2,
              "defaultPrescription": {
                "sets": 3,
                "repsMin": 8,
                "repsMax": 12,
                "restSec": 120,
                "loadConvention": "MACHINE_DISPLAY"
              },
              "prescription": {
                "metric": "REPS",
                "workingSets": 3,
                "repsMin": 8,
                "repsMax": 12,
                "durationMinSeconds": null,
                "durationMaxSeconds": null,
                "targetRirMin": 2,
                "targetRirMax": 3,
                "restTargetSeconds": 120,
                "restAllowedMaxSeconds": 180,
                "loadConvention": "MACHINE_DISPLAY",
                "initialLoadKg": null
              }
            },
            {
              "slotCode": "HR",
              "variant": "M",
              "exerciseCode": "HR-M-PRIMARY",
              "sessionPosition": 3,
              "defaultPrescription": {
                "sets": 3,
                "repsMin": 8,
                "repsMax": 12,
                "restSec": 120,
                "loadConvention": "MACHINE_DISPLAY"
              },
              "prescription": {
                "metric": "REPS",
                "workingSets": 3,
                "repsMin": 8,
                "repsMax": 12,
                "durationMinSeconds": null,
                "durationMaxSeconds": null,
                "targetRirMin": 2,
                "targetRirMax": 3,
                "restTargetSeconds": 120,
                "restAllowedMaxSeconds": 180,
                "loadConvention": "MACHINE_DISPLAY",
                "initialLoadKg": null
              }
            },
            {
              "slotCode": "AE",
              "variant": "BW",
              "exerciseCode": "AE-BW-PRIMARY",
              "sessionPosition": 4,
              "defaultPrescription": {
                "sets": 3,
                "repsMin": 8,
                "repsMax": 12,
                "restSec": 60,
                "loadConvention": "BODYWEIGHT"
              },
              "prescription": {
                "metric": "REPS",
                "workingSets": 3,
                "repsMin": 8,
                "repsMax": 12,
                "durationMinSeconds": null,
                "durationMaxSeconds": null,
                "targetRirMin": null,
                "targetRirMax": null,
                "restTargetSeconds": 60,
                "restAllowedMaxSeconds": 90,
                "loadConvention": "BODYWEIGHT",
                "initialLoadKg": null
              }
            }
          ],
          "rounds": null,
          "betweenExerciseRestSeconds": null,
          "betweenRoundRestSeconds": null,
          "estimatedSeconds": 1992,
          "measuredSeconds": null
        },
        {
          "occurrenceCode": "P01-M-v1-W1-S2",
          "blueprintCode": "D-B",
          "sessionNumber": 2,
          "format": "STANDARD",
          "slots": [
            {
              "slotCode": "UNI",
              "variant": "M",
              "exerciseCode": "UNI-M-PRIMARY",
              "sessionPosition": 1,
              "defaultPrescription": {
                "sets": 3,
                "repsMin": 8,
                "repsMax": 12,
                "restSec": 120,
                "loadConvention": "MACHINE_DISPLAY"
              },
              "prescription": {
                "metric": "REPS",
                "workingSets": 3,
                "repsMin": 8,
                "repsMax": 12,
                "durationMinSeconds": null,
                "durationMaxSeconds": null,
                "targetRirMin": 2,
                "targetRirMax": 3,
                "restTargetSeconds": 120,
                "restAllowedMaxSeconds": 180,
                "loadConvention": "MACHINE_DISPLAY",
                "initialLoadKg": null
              }
            },
            {
              "slotCode": "IP",
              "variant": "M",
              "exerciseCode": "IP-M-PRIMARY",
              "sessionPosition": 2,
              "defaultPrescription": {
                "sets": 3,
                "repsMin": 8,
                "repsMax": 12,
                "restSec": 120,
                "loadConvention": "MACHINE_DISPLAY"
              },
              "prescription": {
                "metric": "REPS",
                "workingSets": 3,
                "repsMin": 8,
                "repsMax": 12,
                "durationMinSeconds": null,
                "durationMaxSeconds": null,
                "targetRirMin": 2,
                "targetRirMax": 3,
                "restTargetSeconds": 120,
                "restAllowedMaxSeconds": 180,
                "loadConvention": "MACHINE_DISPLAY",
                "initialLoadKg": null
              }
            },
            {
              "slotCode": "VR",
              "variant": "M",
              "exerciseCode": "VR-M-PRIMARY",
              "sessionPosition": 3,
              "defaultPrescription": {
                "sets": 3,
                "repsMin": 8,
                "repsMax": 12,
                "restSec": 120,
                "loadConvention": "MACHINE_DISPLAY"
              },
              "prescription": {
                "metric": "REPS",
                "workingSets": 3,
                "repsMin": 8,
                "repsMax": 12,
                "durationMinSeconds": null,
                "durationMaxSeconds": null,
                "targetRirMin": 2,
                "targetRirMax": 3,
                "restTargetSeconds": 120,
                "restAllowedMaxSeconds": 180,
                "loadConvention": "MACHINE_DISPLAY",
                "initialLoadKg": null
              }
            },
            {
              "slotCode": "AL",
              "variant": "BW",
              "exerciseCode": "AL-BW-PRIMARY",
              "sessionPosition": 4,
              "defaultPrescription": {
                "sets": 3,
                "repsMin": 8,
                "repsMax": 12,
                "restSec": 60,
                "loadConvention": "BODYWEIGHT"
              },
              "prescription": {
                "metric": "REPS",
                "workingSets": 3,
                "repsMin": 8,
                "repsMax": 12,
                "durationMinSeconds": null,
                "durationMaxSeconds": null,
                "targetRirMin": null,
                "targetRirMax": null,
                "restTargetSeconds": 60,
                "restAllowedMaxSeconds": 90,
                "loadConvention": "BODYWEIGHT",
                "initialLoadKg": null
              }
            }
          ],
          "rounds": null,
          "betweenExerciseRestSeconds": null,
          "betweenRoundRestSeconds": null,
          "estimatedSeconds": 1992,
          "measuredSeconds": null
        }
      ]
    },
    {
      "weekNumber": 2,
      "phaseNumber": 1,
      "sessions": [
        {
          "occurrenceCode": "P01-M-v1-W2-S1",
          "blueprintCode": "D-A",
          "sessionNumber": 3,
          "format": "STANDARD",
          "slots": [
            {
              "slotCode": "SQ",
              "variant": "M",
              "exerciseCode": "SQ-M-PRIMARY",
              "sessionPosition": 1,
              "defaultPrescription": {
                "sets": 3,
                "repsMin": 8,
                "repsMax": 12,
                "restSec": 120,
                "loadConvention": "MACHINE_DISPLAY"
              },
              "prescription": {
                "metric": "REPS",
                "workingSets": 3,
                "repsMin": 8,
                "repsMax": 12,
                "durationMinSeconds": null,
                "durationMaxSeconds": null,
                "targetRirMin": 2,
                "targetRirMax": 3,
                "restTargetSeconds": 120,
                "restAllowedMaxSeconds": 180,
                "loadConvention": "MACHINE_DISPLAY",
                "initialLoadKg": null
              }
            },
            {
              "slotCode": "HP",
              "variant": "M",
              "exerciseCode": "HP-M-PRIMARY",
              "sessionPosition": 2,
              "defaultPrescription": {
                "sets": 3,
                "repsMin": 8,
                "repsMax": 12,
                "restSec": 120,